{"$schema":"https://json-schema.org/draft/2020-12/schema","$id":"https://mana.local/contracts/mana-inspect/v1/project-context.schema.json","type":"object","additionalProperties":false,"required":["schema","categories","coverage","diagnostics","guarantees"],"properties":{"schema":{"const":"mana.inspect.project-context/v1"},"categories":{"type":"array","items":{"type":"object","additionalProperties":false,"required":["category","artifacts","coverage"],"properties":{"category":{"enum":["architecture","project_decisions","integrations","engineering_guards","glossary","learning_journeys","testing_policy","database_policy"]},"artifacts":{"type":"array","items":{"$ref":"work-items.schema.json#/$defs/artifactRef"}},"coverage":{"enum":["canonical_path_category","missing","unknown"]}}}},"coverage":{"enum":["canonical_global_context","none","unknown"]},"diagnostics":{"type":"array","items":{"$ref":"work-items.schema.json#/$defs/diagnostic"}},"guarantees":{"$ref":"work-items.schema.json#/$defs/guarantees"}}}
