{"schema":"mana.inspect.project-context/v1","categories":[{"category":"architecture","artifacts":[{"artifact_id":"file:.mana/global/architecture.md","path":".mana/global/architecture.md","kind":"markdown","status":"available","label":"Architecture"}],"coverage":"canonical_path_category"},{"category":"project_decisions","artifacts":[],"coverage":"missing"},{"category":"integrations","artifacts":[],"coverage":"missing"},{"category":"engineering_guards","artifacts":[{"artifact_id":"file:.mana/global/engineering-guards.md","path":".mana/global/engineering-guards.md","kind":"markdown","status":"available","label":"Engineering guards"}],"coverage":"canonical_path_category"},{"category":"glossary","artifacts":[],"coverage":"missing"},{"category":"learning_journeys","artifacts":[],"coverage":"missing"},{"category":"testing_policy","artifacts":[],"coverage":"missing"},{"category":"database_policy","artifacts":[],"coverage":"missing"}],"coverage":"canonical_global_context","diagnostics":[],"guarantees":{"model_calls":0,"writes":false,"semantic_inference":"canonical_structured_sources_only"}}
